变量名,name,name_tw,name_en,name_vn,name_kr,name_pt,name_th,desc,desc_tw,desc_en,desc_vn,desc_th,cards,equipID,skinID,attrMap
32913,太阳意志,太陽意志,Sun will,Ý chí của mặt trời,태양의 의지,Sol vai,ซันวิลล์,,,,,,<121;2271;2611>,,,{7=10%;8=10%}
33011,出类拔萃,出類拔萃,Rising Above All,Xuất sắc,훌륭해,Fora do comum,โดดเด่น,,,,,,<3291;3281>,,,{7=10%;8=10%}
33012,水之波动,水之波動,Water Pulse,Gợn sóng nước,물의파동,Ondas de água,คลื่นน้ำ,,,,,,<1241;631;1311;21>,,,{1=12%}
33013,劲敌对决,勁敵對決,Showdown,Trận chiến giữa các Titan,라이벌 대결,Confronto de rivais,การเผชิญหน้าระหว่างคู่แข่ง,,,,,,<1291;11>,,,{7=10%;8=10%}
33014,除恶务尽,除惡務盡,Eradicate evil,Diệt trừ tận gốc,악을 멀리하십시오,Elimine todo o mal,กำจัดความชั่วร้ายทั้งหมด,,,,,,<2821;1841>,,,{14=500}
33041,主角传承,主角傳承,Protagonist Legacy,Di sản nhân vật chính,주인공 계승,Legado do Protagonista,มรดกของตัวเอก,,,,,,<7001>,,,{7=15%;8=15%}
33042,水之波动,水之波動,Water's Ripple,Gợn sóng nước,물결,Ondulação da água,ระลอกน้ำ,,,,,,<1241;631;1311;21>,,,{1=20%}
33043,水之使者,水之使者,Water Messenger,Sứ giả của nước,물의 전령,Mensageiro da Água,ผู้ส่งสารแห่งน้ำ,,,,,,<2411;3681;641>,,,{7=15%;8=15%}
33044,海洋统治,海洋統治,Ocean Rule,Thống trị đại dương,해양 지배,Domínio do Oceano,การปกครองมหาสมุทร,,,,,,<1961;2421;2361>,,,{14=750}
33411,火焰掌控,火焰掌控,Flame Control,Kiểm soát ngọn lửa,화염 제어,Maestria do Fogo,ความเชี่ยวชาญด้านไฟ,,,,,,<471;1611;101>,,,{7=10%;8=10%}
33412,炎焰之力,炎焰之力,Power of Fire,Sức mạnh của ngọn lửa bùng cháy,화염의 힘,Poder da Chama,พลังแห่งเปลวไฟ,,,,,,<1441;2481;271>,,,{1=10%}
33413,太阳意志,太陽意志,Sun will,Ý chí của mặt trời,태양의 의지,Sol vai,ซันวิลล์,,,,,,<471;3511;2071>,,,{7=10%;8=10%}
33511,妖精联盟,妖精聯盟,Pokémon Alliance,Liên minh Tiên nữ,페어리 리그,Aliança das Fadas,พันธมิตรแฟรี่,,,,,,<131;3431;1391>,,,{7=10%;8=10%}
33512,湿地之战,濕地之戰,Battle on the Wetlands,Cuộc chiến vùng đất ngập nước,습지 전투,Guerra das Zonas Húmidas,สงครามพื้นที่ชุ่มน้ำ,,,,,,<3541;3511;2071>,,,{1=12%}
33513,花草共生,花草共生,Symbiosis,Hoa và cỏ cùng sinh sống,꽃과 식물의 공생,Simbiose de flores e plantas,การอยู่ร่วมกันของดอกไม้และพืช,,,,,,<1291;281;781>,,,{7=10%;8=10%}
33514,公主链接,公主連結,Princess Link,Princess Connect!,프린세스 링크,Princesa Link,ลิงค์เจ้าหญิง,,,,,,<3631;2841>,,,{23=500}
34111,幽灵出没,幽靈出沒,Appearance of Ghosts,Ma xuất hiện,유령 유령,Assombração Fantasma,ผีหลอกหลอน,,,,,,<391;1811>,,,{7=10%;8=10%}
34112,钢铁意志,鋼鐵意志,Steel Will,Ý chí sắt thép,강철 같은 의지,Vontade de Ferro,ความตั้งใจอันแรงกล้า,,,,,,<1901;331;2961>,,,{1=12%}
34113,利刃出鞘,利刃出鞘,Knives Out,Đao cạo,칼집에서 칼,Facas e Segredos,มีดออกไป,,,,,,<571;691>,,,{7=10%;8=10%}
34114,盾之勇者,盾之勇者,Shield of the Brave,Anh Hùng Rìu,방패 영웅,O Herói do Escudo,ฮีโร่โล่,,,,,,<3021;3501;2011>,,,{23=500}
34311,龙族克星,龍族剋星,Dragon Buster,Sát Long,드래곤 네메시스,Dragão Nêmesis,มังกรเนเมซิส,,,,,,<171;281;2631>,,,{7=10%;8=10%}
34312,广域伙伴,廣域夥伴,Wide Companion,Đối tác diện rộng,광역 파트너,Parceiros de área ampla,พันธมิตรพื้นที่กว้าง,,,,,,<471;691;2961>,,,{1=10%}
34313,月亮之力,月亮之力,Moonblast,Sức mạnh của mặt trăng,달의 힘,Poder da Lua,พลังแห่งดวงจันทร์,,,,,,<131;2301;2011>,,,{7=10%;8=10%}
34711,水流力量,水流力量,Force of Current,Sức mạnh của dòng nước,현재 힘,Força da Água,พลังน้ำ,,,,,,<551;21;801>,,,{7=10%;8=10%}
34712,水之波动,水之波動,Water Pulse,Gợn sóng nước,물의파동,Ondas de água,คลื่นน้ำ,,,,,,<1441;1861;2871>,,,{1=10%}
34713,覆舟之势,覆舟之勢,Overturn,Xu hướng lật thuyền,전복,A tendência de virar,แนวโน้มที่จะพลิกคว่ำ,,,,,,<2922;2011;3011>,,,{7=10%;8=10%}
35011,岩石壁垒,岩石壁壘,Rock Barrier,Hàng rào đá,바위 장벽,Parede de pedra,กำแพงหิน,,,,,,<301;691;2591>,,,{7=10%;8=10%}
35012,沙暴之势,沙暴之勢,Sandstorm,Sức mạnh của bão cát,모래 폭풍,Tempestade de areia,พายุทราย,,,,,,<1081;2871;3011>,,,{1=10%}
35013,自然组合,自然組合,Natural combination,Kết hợp tự nhiên,자연스러운 조합,Combinação natural,การผสมผสานที่เป็นธรรมชาติ,,,,,,<541;2301;1861>,,,{7=10%;8=10%}
35111,格斗势力,格鬥勢力,Fighting Forces,Lực lượng chiến đấu,싸우는 힘,Força de combate,กำลังรบ,,,,,,<271;2631;2271>,,,{7=10%;8=10%}
35112,拳之力量,拳之力量,Fist Power,Sức mạnh của nắm đấm,주먹의 힘,O poder do punho,พลังแห่งกำปั้น,,,,,,<231;461;1441;51>,,,{1=10%}
35113,技巧掌控,技巧掌控,Technique control,Thủ thuật thành thạo,스킬 컨트롤,Controle de habilidades,การควบคุมทักษะ,,,,,,<2961;791;3431>,,,{7=10%;8=10%}
35411,龙之波动,龍之波動,Dragon Pulse,Sóng thần Rồng,용의 파동,Onda do Dragão,มังกรคลื่น,,,,,,<3141;1891>,,,{7=10%;8=10%}
35412,肥大体型,肥大體型,Extra-large size,Thể trạng béo phì,비대,Corpo obeso,ร่างกายอ้วน,,,,,,<751;711;2481>,,,{1=12%}
35413,盾之勇者,盾之勇者,Shield of the Brave,Anh Hùng Rìu,방패 영웅,O Herói do Escudo,ฮีโร่โล่,,,,,,<3021;3501;2011>,,,{7=10%;8=10%}
35414,同行伙伴,同行夥伴,Companions,Bạn đồng hành,동료 파트너,Parceiros,พันธมิตร,,,,,,<3301;3511;91>,,,{23=500}
35611,幽灵感应,幽靈感應,Ghost Detection,Cảm giác ma,영감은,Sentido Fantasma,สัมผัสผี,,,,,,<1351;801;781>,,,{7=8%;8=8%}
35612,魅影同伴,魅影同伴,Phantom Companion,Bạn đồng hành ma quái,팬텀 컴패니언,Companheiro Fantasma,สหายผี,,,,,,<171;2011;3281>,,,{1=10%}
35613,魂魄之力,魂魄之力,Soul Power,Sức mạnh linh hồn,아스트랄 파워,Poder da alma,พลังแห่งวิญญาณ,,,,,,<2961;111;301>,,,{7=8%;8=8%}
35911,低空势力,低空勢力,Low-altitude forces,Lực lượng tầm thấp,낮은 고도의 힘,Forças de baixa altitude,กองกำลังระดับความสูงต่ำ,,,,,,<571;51>,,,{7=10%;8=10%}
35912,输出全靠吼,輸出全靠吼,Dealing damage with a roar,Đầu ra phụ thuộc hoàn toàn vào việc hét lên,출력은 모두 포효에 달려 있습니다.,A saída depende inteiramente do rugido,เอาท์พุตขึ้นอยู่กับเสียงคำรามล้วนๆ,,,,,,<1391;1441;61>,,,{1=12%}
35913,龙龙军团,龍龍軍團,Dragon Team,Đội quân Longlong,드래곤 아미,Legião do Dragão,กองทัพมังกร,,,,,,<2231;3541>,,,{7=10%;8=10%}
35914,洞穴索居,洞穴索居,Cave Living,Sống ẩn dật trong hang động,동굴 체류,Habitação em caverna,การอยู่อาศัยในถ้ำ,,,,,,<401;301>,,,{23=500}
36011,美丽动人,美麗動人,Beautiful and moving,Đẹp và cảm động,아름답고 감동적이다,Lindo,สวย,,,,,,<3261;1771;2401>,,,{7=15%;8=15%}
36012,妖精同盟,妖精同盟,Fairy Alliance,Liên minh Tiên nữ,요정 동맹,Aliança das Fadas,พันธมิตรแฟรี่,,,,,,<3351;1391;861;3681>,,,{1=20%}
36013,大地复苏,大地復蘇,The earth awakens,Trái đất hồi sinh,대지의 각성,Ressurreição da Terra,การฟื้นคืนชีพของโลก,,,,,,<1971;2441;3631>,,,{7=15%;8=15%}
36014,X/Y,X/Y,X/Y,X/Y,X/Y,X/Y,เอ็กซ์/วาย,,,,,,<3611>,,,{23=750}
36111,破坏之王,破壞之王,King of Destruction,Vua Hủy Diệt,파괴의 왕,O Rei da Destruição,ราชาแห่งการทำลายล้าง,,,,,,<2431;3171;1031>,,,{7=15%;8=15%}
36112,恶魔祷告,惡魔禱告,Demon Prayer,Lời nguyện của ác quỷ,악마 기도,Oração do Diabo,คำอธิษฐานของซาตาน,,,,,,<3641;4131;381>,,,{1=20%}
36113,恶系军团,惡系軍團,Dark Legion,Đội quân Ác,악계 군단,Exército do Mal,กองทัพปีศาจ,,,,,,<1171;1841;2821;1801>,,,{7=15%;8=15%}
36114,以牙还牙,以牙還牙,Tooth for tooth,Ăn miếng trả miếng,첨예한 대립,Dente por dente,ฟันต่อฟัน,,,,,,<3241;1911;1811>,,,{14=750}
36211,一方霸主,一方霸主,Unilateral Hegemon,Kẻ thống trị đơn phương,일방적 패권,Hegemonia unilateral,ผู้ครอบงำฝ่ายเดียว,,,,,,<1971;2391>,,,{7=15%;8=15%}
36212,地面行者,地面行者,Ground Walker,Người đi trên mặt đất,지면 보행자,Andarilho Terrestre,ผู้เดินบนพื้นดิน,,,,,,<491;401;3231>,,,{1=20%}
36213,龙族核心,龍族核心,Dragon Clan Core,Lõi của bộ tộc Rồng,용족 핵심,Núcleo do Clã do Dragão,แก่นแท้เผ่ามังกร,,,,,,<2231;751;1891>,,,{7=15%;8=15%}
36214,X/Y/Z,X／Y／Z,X/Y/Z,X/Y/Z,X/Y/Z,X/Y/Z,X/Y/Z,,,,,,<3611;3601>,,,{23=750}
36311,天赋异禀,天賦異稟,Gifted,Có tài năng thiên bẩm,하늘이 내린 재능,Dotado,มีพรสวรรค์,,,,,,<761;771;3541>,,,{7=15%;8=15%}
36312,钻石辉光,鑽石輝光,The Diamond Glow,Ánh sáng kim cương,다이아몬드 글로우,Brilho de diamante,ไดมอนด์โกลว์,,,,,,<1251;1501;491>,,,{1=20%}
36313,公主链接,公主連結,Princess Link,Princess Connect!,프린세스 링크,Princesa Link,ลิงค์เจ้าหญิง,,,,,,<1271;1391;2841>,,,{7=15%;8=15%}
36314,相生相克,相生相剋,Enhance and counteract,Sinh khắc tương sinh,타감,Promoção mútua e contenção mútua,การส่งเสริมซึ่งกันและกันและการยับยั้งชั่งใจร่วมกัน,,,,,,<3431;1981;131;3541>,,,{23=750}
36411,超凡意志,超凡意志,Extraordinary Will,Ý chí phi thường,비범한 의지,Vontade extraordinária,ความปรารถนาอันพิเศษ,,,,,,<261;1941;1951;1901>,,,{7=15%;8=15%}
36412,惩戒光环,懲戒光環,Retribution Aura,Ánh hào quang trừng phạt,징계 후광,Aura de punição,ออร่าแห่งการลงโทษ,,,,,,<2391;2991;3661>,,,{1=20%}
36413,原始力量,原始力量,Raw Power,Sức mạnh nguyên thủy,원초의 힘,Poder bruto,พลังดิบ,,,,,,<1971;751;401;301>,,,{7=15%;8=15%}
36414,毁灭对抗,毀滅對抗,Counter Destroy,Sự hủy diệt chống lại sự đối đầu,파멸 대항,Confronto de destruição,การเผชิญหน้าการทำลายล้าง,,,,,,<3211;3301;1031>,,,{14=750}
36511,蓄能岩浆,蓄能岩漿,Magma Reservoir,Hồ Magma tích trữ,마그마 저장소,Reservatório de Magma,แหล่งแมกมา,,,,,,<1971;1231;3671;2371>,,,{7=15%;8=15%}
36512,水压蓄能,水壓蓄能,Hydro-pneumatic energy storage,Lưu trữ năng lượng thủy khí nén,수압 축적 에너지,Armazenamento de energia hidropneumática,การกักเก็บพลังงานไฮโดรนิวเมติก,,,,,,<1961;321;641;2411>,,,{1=20%}
36513,大地轰动,大地轟動,The earth trembled,Đất rung chuyển,땅이 흔들렸다,A terra tremeu,แผ่นดินสั่นสะเทือน,,,,,,<4023;2481>,,,{7=15%;8=15%}
36514,要塞机关,要塞機關,Fortress Agency,Cơ quan Pháo đài,요새 기관,Agência da Fortaleza,หน่วยงานป้อมปราการ,,,,,,<4111>,,,{23=750}
36611,草系力量,草系力量,Grass Power,Sức mạnh hệ Cỏ,잔디 힘,Poder da grama,พลังหญ้า,,,,,,<1291;2471;281>,,,{7=10%;8=10%}
36612,鬼影出没,鬼影出沒,Ghost Around,Hình bóng ma xuất hiện,유령 감염,Fantasma,ผี,,,,,,<3411;1851;2922>,,,{1=12%}
36613,誓约伙伴,誓約夥伴,Vow Partner,Đối tác thề ước,맹세 파트너,Parceiro de compromisso,พันธมิตรผู้ให้คำมั่นสัญญา,,,,,,<591;271;91>,,,{7=10%;8=10%}
36614,精准狩猎,精准狩獵,Precision Hunting,Săn bắn chính xác,정밀 사냥,Caça de precisão,การล่าสัตว์อย่างแม่นยำ,,,,,,<3001;571;3511>,,,{14=500}
36811,妖精同盟,妖精同盟,Fairy Alliance,Liên minh Tiên,요정 연맹,Aliança das Fadas,พันธมิตรแฟรี่,,,,,,<3351;1391;3431>,,,{7=10%;8=10%}
36812,水样年华,水樣年華,Watery Years,Những năm tháng tươi trẻ như nước,물같은 세월,Anos como água,ปีที่คล้ายน้ำ,,,,,,<1241;641;1311>,,,{1=12%}
36813,海洋生物,海洋生物,Marine life,Sinh vật biển,해양 생물,Vida marinha,ชีวิตใต้ท้องทะเล,,,,,,<3771;381;3471;1861>,,,{7=10%;8=10%}
36814,美丽动人,美麗動人,Beautiful and moving,Đẹp và cảm động,아름답고 감동적이다,Lindo,สวย,,,,,,<1771;2401>,,,{23=500}
37711,毒击学习,毒擊學習,Poison Strike,Học hỏi về Độc Kích,악랄학습,Aprendizagem de ataque de veneno,การเรียนรู้การโจมตีด้วยพิษ,,,,,,<161;371;81>,,,{7=10%;8=10%}
37712,水流冲击,水流衝擊,Aqua Smash,Tác động của dòng nước,물살충격,Impacto da água,ผลกระทบจากน้ำ,,,,,,<641;631>,,,{1=12%}
37713,小次郎!,小次郎!,James!,Kojiro!,코지로！,Kojiro!,โคจิโร่!,,,,,,<3661;391;3011>,,,{7=10%;8=10%}
37714,冒险同伴,冒險同伴,Adventure Companion,Những người bạn đồng hành phiêu lưu,모험 짝꿍,Companheiro de aventura,เพื่อนร่วมผจญภัย,,,,,,<241;301;481>,,,{23=500}
38411,草系力量,草系力量,Grass Power,Sức mạnh hệ Cỏ,잔디 힘,Poder da grama,พลังหญ้า,,,,,,<3661;2011;781>,,,{7=10%;8=10%}
38412,超级对抗,超級對抗,Super Encounter,Siêu đối đầu,슈퍼 대결,Super confronto,การเผชิญหน้าครั้งยิ่งใหญ่,,,,,,<381;3771;221;1861>,,,{1=12%}
38413,香气弥漫,香氣彌漫,Aroma Pervade,Mùi thơm lan tỏa,향기 자욱,O aroma está em todo lugar,กลิ่นหอมฟุ้งไปทั่ว,,,,,,<711;3281;281>,,,{7=10%;8=10%}
38414,竟跑同伴,竟跑同伴,Run Companion,"Đột nhiên bỏ chạy, bạn đồng hành",달리기 파트너,Companheiro de corrida,เพื่อนคู่ใจในการวิ่ง,,,,,,<241;2241;271>,,,{14=500}
40231,形态转化,形態轉化,Morphological Transformation,Biến đổi hình thái,형태 변환,Transformação morfológica,การเปลี่ยนแปลงรูปทรง,,,,,,<3261;3191;3413>,,,{7=15%;8=15%}
40232,闪耀光芒,閃耀光芒,Shining brightly,Tỏa sáng rực rỡ,빛나게 빛나다,Brilhando intensamente,เปล่งประกาย,,,,,,<2351;1231;3161;1901>,,,{1=20%}
40233,超能异士,超能異士,Supernaturalist,Siêu năng lực giả,초능력자,Super-humano,ผู้มีพลังเหนือธรรมชาติ,,,,,,<2401;771;1393;4081>,,,{7=15%;8=15%}
40234,钢铁战士,鋼鐵戰士,Iron Warrior,Chiến binh thép,강철 전사,Guerreiro de Aço,นักรบเหล็ก,,,,,,<3271;4171;3161>,,,{23=750}
40241,灵魂纠缠,靈魂糾纏,Soul entanglement,Sự ràng buộc linh hồn,영혼의 얽힘,Emaranhamento de almas,การพันกันของวิญญาณ,,,,,,<4121;3961;971;4151>,,,{7=15%;8=15%}
40242,掌控心灵,掌控心靈,Mastering the Mind,Thần giao cách cảm,마음을 다스리다,Dominando a Mente,การควบคุมจิตใจ,,,,,,<1261;1281;262>,,,{1=20%}
40243,月之祝福,月之祝福,Moon's Blessing,Lộc trời ban,달의 축복,Bênção da Lua,พรจากดวงจันทร์,,,,,,<861;2401>,,,{7=15%;8=15%}
40244,日月同辉,日月同輝,Sun and moon shining together,Mặt trời và mặt trăng cùng tỏa sáng,해와 달이 함께 빛나다,Sol e lua brilhando juntos,ดวงอาทิตย์และดวงจันทร์ส่องแสงพร้อมกัน,,,,,,<4023>,,,{23=750}
41011,漆黑身姿,漆黑的身姿,A pitch-black figure,Một thân hình đen như mực,칠흑 같은 자태,Uma figura de negro profundo,ร่างกายสีดำสนิท,,,,,,<4121;3221;2821>,,,{7=15%;8=15%}
41012,棱镜反射,稜鏡反射,Prism reflection,Phản xạ lăng kính,프리즘 반사,Reflexão do prisma,การสะท้อนของปริซึม,,,,,,<1921;3021>,,,{1=20%}
41013,精神之力,精神之力,Power of the Spirit,Sức mạnh tinh thần,정신의 힘,Poder do Espírito,พลังแห่งจิตวิญญาณ,,,,,,<1991;321;1901;261>,,,{7=15%;8=15%}
41014,日月同辉,日月同輝,The sun and moon shine together,Mặt trời và mặt trăng cùng tỏa sáng,해와 달이 함께 빛나다,O sol e a lua brilham juntos,ดวงอาทิตย์และดวงจันทร์ส่องแสงพร้อมกัน,,,,,,<4023;4024>,,,{14=750}
41111,机巧魄心,機巧魄心,Ingenious Mind,Trí tuệ tinh xảo,독창적인 마음,Mente engenhosa,ความคิดที่ชาญฉลาด,,,,,,<4171;1901;4081;4071>,,,{7=15%;8=15%}
41112,绚烂装饰,絢爛裝飾,Splendid decoration,Trang trí lộng lẫy,화려한 장식,Decoração esplêndida,การตกแต่งที่งดงาม,,,,,,<3841;1393;3353>,,,{1=20%}
41113,妖精机关,妖精機關,Fairy Gear,Cơ quan yêu tinh,요정 기관,Engrenagem de Fada,กลไกของนางฟ้า,,,,,,<561;3961;3681;861>,,,{7=15%;8=15%}
41114,意识同步,意識同步,Consciousness synchronization,Đồng bộ ý thức,의식 동기화,Sincronização da consciência,การประสานจิตสำนึก,,,,,,<1991;3631;2421>,,,{23=750}
41211,幽灵行者,幽靈行者,Ghost Walker,Người Đi Bộ Ma,유령 워커,Andarilho Fantasma,ผีเดิน,,,,,,<2391;2991;391;3961>,,,{7=15%;8=15%}
41212,格斗大师,格鬥大師,Martial Arts Master,Đại sư võ thuật,격투 마스터,Mestre de Artes Marciais,ปรมาจารย์ศิลปะการต่อสู้,,,,,,<3261;2021;1301;2241>,,,{1=20%}
41213,精神操控,精神控制,Mind control,Kiểm soát tâm trí,마음 조종,Controle mental,การควบคุมจิตใจ,,,,,,<601;591;331>,,,{7=15%;8=15%}
41214,萌样神兽,萌樣神獸,Cute Mythical Beast,Thú thần dễ thương,귀여운 신수,Besta mítica fofa,สัตว์เทพน่ารัก,,,,,,<2441;1281;1991>,,,{14=750}
41311,毒气攻击,毒氣攻擊,Gas Attack,Vụ tấn công khí độc,독가스 공격,Ataque de gás,การโจมตีด้วยแก๊ส,,,,,,<161;3771;2681>,,,{7=10%;8=10%}
41312,似龙非龙,似龍非龍,Dragon Like,Giống rồng mà không phải rồng,용과 닮음,"Como um dragão, mas não um dragão",เหมือนมังกรแต่ไม่ใช่มังกร,,,,,,<3591;1891;701>,,,{1=12%}
41313,誓约之力,誓約之力,Power of Oath,Sức mạnh của lời thề,서약의 힘,Poder do Juramento,อำนาจแห่งคำสาบาน,,,,,,<3661;3841;221>,,,{7=10%;8=10%}
41314,同行伙伴,同行夥伴,Peer Partner,Bạn đồng hành,동행 파트너,Parceiros,พันธมิตร,,,,,,<751;91;341>,,,{14=500}
41611,大型幻兽,大型幻獸,Large Phantasmal Beast,Thú ảo khổng lồ,거대 환수,Grande Besta de Fantasia,สัตว์แฟนตาซีขนาดใหญ่,,,,,,<2431;4171;3251>,,,{7=15%;8=15%}
41612,无影无踪,無影無蹤,Vanished without a trace,Biến mất không dấu vết,흔적도 없이 사라짐,Nenhum traço,ไม่มีร่องรอย,,,,,,<3201;701;731;3661>,,,{1=20%}
41613,高速储能,高速儲能,High-speed energy storage,Lưu trữ năng lượng tốc độ cao,고속 에너지 저장,Armazenamento de energia de alta velocidade,ระบบกักเก็บพลังงานความเร็วสูง,,,,,,<3271;591;881>,,,{7=15%;8=15%}
41614,雷电身法,雷電身法,Thunderclap Body Technique,Thân pháp sấm sét,뇌전신법,Habilidades do corpo relâmpago,ทักษะร่างกายสายฟ้า,,,,,,<3221;7001;1221>,,,{14=750}
41711,极限钢铁,極限鋼鐵,Extreme Steel,Thép Siêu Cường,극한 강철,Aço Extremo,เหล็กเอ็กซ์ตรีม,,,,,,<1991;3161;3411>,,,{7=15%;8=15%}
41712,加农光炮,加農光炮,Laser Cannon,Pháo laser,캐논 빔,Canhão Canhão de Luz,ปืนใหญ่ ปืนใหญ่เบา,,,,,,<1901;331;1931;21>,,,{1=20%}
41713,金属大骚动,金屬大騷動,Metal Uproar,Sự hỗn loạn của kim loại,금속 대소동,Motim de Metal,เมทัล ไรออท,,,,,,<2441;3661;3771>,,,{7=15%;8=15%}
41714,联盟对战,聯盟對戰,Alliance Battle,Trận chiến liên minh,연맹 대전,Batalha da Aliança,การต่อสู้ของพันธมิตร,,,,,,<3221;3841;571;1301>,,,{23=750}
70011,电光一闪,電光一閃,Quick Attack,Một tia chớp,전광 번쩍,Um relâmpago,สายฟ้าแลบ,,,,,,<331;731;2071;91>,,,{7=10%;8=10%}
70012,神圣之火,神聖之火,Sacred Fire,Ngọn lửa thiêng liêng,성스러운 불꽃,Fogo Sagrado,ไฟศักดิ์สิทธิ์,,,,,,<1301;2991;2481;11>,,,{1=12%}
70013,水之誓约,水之誓約,Oath of Water,Hiệp ước nước,물의 서약,Compromisso com a água,คำมั่นสัญญาเรื่องน้ำ,,,,,,<3301;3771;221;21>,,,{7=10%;8=10%}
70014,万有引力,萬有引力,Gravity,Lực hấp dẫn vạn vật,만유인력,gravidade,แรงโน้มถ่วง,,,,,,<2471;3841;781;1>,,,{22=500}
70211,毒素蔓延,毒素蔓延,Toxic spread,Sự lây lan chất độc,독소 확산,Proliferação de toxinas,การแพร่กระจายของสารพิษ,,,,,,<393;3771;161;4031>,,,{7=15%;8=15%}
70212,卷土重来,捲土重來,To make a comeback; to stage a comeback,Sự trở lại mạnh mẽ; quay trở lại,재기하다; 다시 일어서다,Retornar com força; fazer uma reaparição,กลับมาอย่างแข็งแกร่ง; การกลับมาอีกครั้ง,,,,,,<1251;1901;771>,,,{1=20%}
70213,闪亮登场,閃亮登場,Grand entrance,Sự xuất hiện rực rỡ,화려한 등장,Entrada triunfal,การปรากฏตัวอย่างตระการตา,,,,,,<4024;4023>,,,{7=15%;8=15%}
70214,幽冥魂殿,幽冥魂殿,幽冥魂殿 (Yōuméi Húndiàn),幽冥魂殿 (Âu Minh Hồn Điện),幽冥魂殿 (Umyeong Honjeon),幽冥魂殿 (Yōuméi Húndiàn),幽冥魂殿 (Yūmíng Húndiàn),,,,,,<2391;4121;4024>,,,{23=750}
70311,远古之力,遠古之力,Ancient power,Sức mạnh cổ đại,고대의 힘,Poder antigo,พลังโบราณ,,,,,,<7041;7051>,,,{7=50%;8=50%}
70411,远古之力,遠古之力,Ancient power,Sức mạnh cổ đại,고대의 힘,Poder ancestral,พลังโบราณ,,,,,,<7031;7051>,,,{7=50%;8=50%}
70511,远古之力,遠古之力,Ancient Power,Sức mạnh cổ xưa,고대의 힘,Poder Antigo,พลังแห่งยุคโบราณ,,,,,,<7031;7041>,,,{7=50%;8=50%}
70711,群居而生,群居而生,Living in groups,Sống theo đàn,무리 지어 사는,Vivendo em grupo,อยู่รวมกันเป็นกลุ่ม,,,,,,<571;1071;611;3151>,,,{7=10%;8=10%}
70712,格斗达人,格鬥達人,Fighting Master,Đại sư võ thuật,격투의 달인,Mestre de luta,จ้าวแห่งการต่อสู้,,,,,,<3251>,,,{1=12%}
70713,单挑出站,單挑出站,One-on-one showdown,Đấu một chọi một,일대일 대결,Duelo um contra um,การต่อสู้แบบตัวต่อตัว,,,,,,<251>,,,{7=10%;8=10%}
70714,究极异兽,究級異獸,Ultimate Beast,Thú Hoang Cực Đỉnh,궁극의 괴수,Besta Final,อสูรขั้นสูงสุด,,,,,,<4141;4151>,,,{14=500}
70811,超能精神,超能精神,Supernatural Spirit,Linh hồn siêu nhiên,초능력 정신,Espírito sobrenatural,จิตวิญญาณเหนือธรรมชาติ,,,,,,<2401;261>,,,{7=15%;8=15%}
70812,可可爱爱,可可愛愛,Cute,Dễ thương,귀여워,Fofo,น่ารัก,,,,,,<861;3961;501;2411>,,,{1=20%}
70813,超级仿制,超級仿製,Super imitation,Siêu nhái,초고퀄리티 모조품,Super imitação,เลียนแบบระดับสูง,,,,,,<761>,,,{7=15%;8=15%}
70814,起源幻兽,起源幻獸,Origin Phantasma,Thú Huyền Thoại Nguồn Gốc,기원 환수,Fantasma de Origem,สัตว์อสูรแห่งจุดกำเนิด,,,,,,<1281;1991;3261>,,,{14=750}
