变量名,name,name_tw,name_vn,name_en,name_kr,name_pt,name_th,languages,logo,res,resAct,resSpine,crossMineResSpine,qFigureres,qRoleSpine,zOrder,resBack,type,showIdx,pos,actPos,desc,desc_tw,desc_vn,desc_en,desc_kr,desc_pt,desc_th,unlock,unlockDesc,unlockDesc_tw,unlockDesc_vn,unlockDesc_en,unlockDesc_kr,unlockDesc_pt,unlockDesc_th,unavalibleDesc,activeCost,attrNatureType1,attrType1,attrValue1,attrNatureType2,attrType2,attrValue2,attrNatureType3,attrType3,attrValue3,skills,activeLevel,hide,hide_tw,hide_en,hide_vn,hide_kr,overture,offPos,chattext1,chattext1_tw,chattext1_en,chattext1_vn,chattext1_kr,chattext1_pt,chattext1_th,chattext2,chattext2_tw,chattext2_en,chattext2_vn,chattext2_kr,chattext2_pt,chattext2_th,chattext3,chattext3_tw,chattext3_en,chattext3_vn,chattext3_kr,chattext3_pt,chattext3_th,crossArenaPos
60,丹帝,丹帝,Leon,Leon,Leon,Leon,Leon,,config/portrait/toptouxiang/img_role_60@.png,config/big_role/show/img_role_60@.png,config/big_role/show/img_role_60@.png,figure/dandi/dandi.skel,crossmine/q_xiaozhi.skel,config/portrait/qbanrenwu/img_role_60.png,,12,personal/img_bjt3.png,2,100,{y=436;x=1750},{y=0;x=0},在宝可梦对战的官方赛事中从未输过，无与伦比的实力与人品兼具的他受到广大的欢迎，是伽勒尔地区名符其实的“最强”宝可梦训练家,在寶可夢正式比賽中從未輸過，因為無與倫比的實力與人格魅力而廣受歡迎，是名副其實的伽勒爾最強訓練家。,"Bất bại trong các giải đấu chính thức, huấn luyện viên mạnh nhất vùng Galar được yêu mến nhờ sức mạnh và nhân cách.","He has never lost in the official competition of Pokemon battles. He is widely welcomed for his unparalleled strength and character. He is the veritable \""strongest\"" Pokemon trainer in the Galar region.","공식 포켓몬 배틀에서 단 한 번도 진 적 없는 그는, 강한 실력과 인격으로 사랑받으며, 가라르의 '최강' 트레이너입니다.","Nunca perdeu uma batalha oficial. Amado por sua força e caráter, é o verdadeiro “mais forte” treinador Pokémon da região de Galar.",ไม่เคยแพ้ในการแข่งขันโปเกมอนอย่างเป็นทางการ เป็นที่รักเพราะพลังและบุคลิกภาพที่ยอดเยี่ยม เขาคือ “เทรนเนอร์ที่แข็งแกร่งที่สุด” แห่ง Galar อย่างแท้จริง,{5=13},VIP等級13級後可解鎖,VIP等級13級後可解鎖,Mở khóa ở VIP cấp 13,Unlocked at VIP Level 13,VIP 등급 13 달성 시 해제,Desbloqueado no Nível VIP 13,ปลดล็อกเมื่อถึง VIP ระดับ 13,,{rmb=58888},0,7,3%,0,8,3%,0,0,,<70027>,<1>,0,0,0,0,0,TRUE,{y=-50;x=160},,因為我是個路痴，常常迷路，但！也正因如此才會有意想不到的邂逅！,"Because I am a road idiot, I often get lost. but! It is also because of this that there will be unexpected encounters!",vì tôi là kẻ lạc đường nên thường xuyên bị mất phương hướng. nhưng! cũng nhờ đó mà có những cuộc gặp gỡ bất ngờ!,나는 길치라 자주 길을 잃지만! 그래서 예상치 못한 만남도 있지!,"porque sou meio perdido, frequentemente me perco. mas! é também por isso que ocorrem encontros inesperados!",เพราะฉันเป็นคนขับรถไม่เก่ง มักจะหลงทาง แต่! นั่นก็ทำให้ได้เจอเรื่องที่ไม่คาดคิด!,,帕西歐的星空真美！如果你認真許願，也許星星會落下來！,"Pasio's starry sky is so beautiful! If you make a wish seriously, maybe the stars will fall to you!","Bầu trời đầy sao ở Pasio thật đẹp! Nếu bạn cầu nguyện thật lòng, có thể sao sẽ rơi xuống!",파시오의 별이 빛나는 하늘은 정말 아름다워! 진심으로 소원 빌면 별이 떨어질지도 몰라!,"O céu estrelado de Pasio é tão bonito! Se você fizer um pedido sério, talvez as estrelas caiam para você!",ท้องฟ้าที่เต็มไปด้วยดาวที่ปาซิโอ สวยมาก! ถ้าขอพรจริงๆ ดาวอาจจะตกลงมาให้!,,時間到了！但我的冠軍時刻還沒結束！,It's already this time! But my championship time is not over yet!,đã đến lúc rồi! nhưng thời gian vô địch của tớ chưa kết thúc!,벌써 시간이야! 하지만 내 챔피언 시간은 아직 끝나지 않았어!,Já é hora! Mas meu tempo de campeonato ainda não acabou!,ถึงเวลานี้แล้ว! แต่เวลาของแชมป์ยังไม่จบ!,{y=0;x=0}
61,彩豆,彩豆,Bea,Bea,채두,Bea,ไซโต,,config/portrait/toptouxiang/img_role_61@.png,config/big_role/show/img_role_61@.png,config/big_role/show/img_role_61@.png,figure/caidou/caidou.skel,crossmine/q_xiaozhi.skel,config/portrait/qbanrenwu/img_role_61.png,,12,personal/img_bjt3.png,2,100,{y=436;x=1750},{y=0;x=0},伽勒尔地区的溯传镇溯传竞技场的道馆馆主，是拥有百年历史的伽勒尔空手道的天才指长使用格斗属性的宝可梦,伽勒尔地区的溯传镇溯传竞技场的道馆馆主，是拥有百年历史的伽勒尔空手道的天才指长使用格斗属性的宝可梦,Trưởng Nhà thi đấu của Sân vận động Stow-on-Side thuộc vùng Galar. Cô là một thiên tài của Karate Galar với lịch sử trăm năm và sử dụng các Pokémon hệ Giác đấu.,The Gym Leader of Stow-on-Side Stadium in the Galar region. She is a prodigy of the century-old Galar Karate and uses Fighting-type Pokémon.,가라르지방의 래터럴마을에 위치한 래터럴스타디움의 체육관 관장입니다. 100년의 역사를 자랑하는 가라르 가라테의 천재이며 격투타입 포켓몬을 사용합니다.,"A Líder de Ginásio do Estádio de Stow-on-Side, na região de Galar. Ela é um prodígio do Karatê de Galar, uma arte com um século de história, e usa Pokémon do tipo Lutador.",ยิมลีดเดอร์แห่งสนามประลองลาเทอรัลในเมืองลาเทอรัล ภูมิภาคกาลาร์ เป็นอัจฉริยะแห่งกาลาร์คาราเต้ที่มีประวัติศาสตร์ยาวนานนับร้อยปี และใช้โปเกมอนประเภทต่อสู้,{5=13},VIP等級13級後可解鎖,VIP等級13級後可解鎖,Mở khóa ở VIP cấp 13,Unlocked at VIP Level 13,VIP 등급 13 달성 시 해제,Desbloqueado no Nível VIP 13,ปลดล็อกเมื่อถึง VIP ระดับ 13,,{rmb=58888},0,7,2%,0,7,480,0,0,,<70045>,<1>,0,0,0,0,0,TRUE,{y=-50;x=160},,1,1,1,1,1,1,1,1,1,1,1,1,1,,1,1,1,1,1,1,{y=0;x=0}
62,卡露妮(活动限定),卡露妮（活動限定）,Diantha(Event Limited),Diantha(Event Limited),Diantha(Event Limited),Diantha(Event Limited),Diantha(Event Limited),,config/portrait/toptouxiang/img_role_62@.png,config/big_role/show/img_role_62@.png,config/big_role/show/img_role_62@.png,figure/zqkaluni/zqkaluni.skel,crossmine/q_xiaozhi.skel,config/portrait/qbanrenwu/img_role_62.png,,12,personal/img_bjt3.png,2,100,{y=436;x=1750},{y=0;x=0},身着华服的知名女星，同时也是宝可梦训练家，有时似乎会对有实力的训练家表示兴趣,她是一位著名女演員，穿著華麗的服裝，同時也是寶可夢訓練家。有時她似乎對有實力的訓練家表現出興趣。,"Nữ diễn viên nổi tiếng trong trang phục lộng lẫy, đôi khi bày tỏ sự quan tâm tới các huấn luyện viên tài năng.",A well-known actress in gorgeous costumes who is also a Pokemon trainer. She sometimes seems to express interest in capable trainers.,"화려한 의상을 입은 유명 여배우이자 포켓몬 트레이너이며, 종종 실력 있는 트레이너에게 관심을 보입니다.",Uma atriz famosa com trajes deslumbrantes que também é treinadora Pokémon. Às vezes demonstra interesse por treinadores habilidosos.,นักแสดงชื่อดังในชุดสวยหรูที่เป็นเทรนเนอร์โปเกมอนเช่นกัน บางครั้งดูเหมือนจะสนใจเทรนเนอร์ที่เก่งๆ,{5=16},VIP等級16級後可解鎖,VIP等級16級後可解鎖,Mở khóa ở VIP cấp 16,Unlocked at VIP Level 16,VIP 등급 16 달성 시 해제,Desbloqueado no Nível VIP 16,ปลดล็อกเมื่อถึง VIP ระดับ 16,,{rmb=118888},0,1,6%,0,23,6%,0,0,,<70046>,<1>,0,0,0,0,0,TRUE,{y=-50;x=160},,歡迎，我是冠軍 Diantha。,"Welcome, I am the champion Diantha.","chào mừng, tôi là nhà vô địch diantha.","환영해, 나는 챔피언 디안타야.","bem-vindo, eu sou a campeã diantha.",ยินดีต้อนรับ ฉันคือแชมป์เปี้ยนไดแอนธา,,一位擁有高貴靈魂和寶可夢優雅的訓練家，讓我的心劇烈震顫,"A trainer with a noble soul and the grace of Pokemon, making my heart tremble intensely","Một huấn luyện viên với tâm hồn cao quý và vẻ duyên dáng của Pokémon, làm tim tôi rung động mãnh liệt","고귀한 영혼과 포켓몬의 우아함을 가진 트레이너, 내 마음을 강하게 떨리게 해","Um treinador com alma nobre e a graça dos Pokémon, fazendo meu coração vibrar intensamente",เทรนเนอร์ที่มีจิตใจดีและมีเสน่ห์ของโปเกมอน ทำให้หัวใจฉันเต้นแรง,,擁有你和你的寶可夢這樣的力量，我期待你將展現的輝煌！,"With such power in you and your Pokemon, I am eagerly anticipating the brilliance you will unleash!","với sức mạnh của cậu và pokemon, tớ rất mong đợi sự rực rỡ mà cậu sẽ thể hiện!","너와 네 포켓몬에게 그런 힘이 있으니, 네가 발휘할 빛남이 매우 기대돼!","Com tanto poder em você e seus Pokémon, estou ansioso para o brilho que você vai liberar!",ด้วยพลังขนาดนี้ในตัวเธอและโปเกมอน ฉันตั้งตารอความเจิดจ้าที่เธอจะปลดปล่อย!,{y=0;x=0}
63,辛俐,辛俐,Rika,Rika,칠리,Rika,ซากิ,,config/portrait/toptouxiang/img_role_63@.png,config/big_role/show/img_role_63@.png,config/big_role/show/img_role_63@.png,figure/xinli/xinli.skel,crossmine/q_xiaozhi.skel,config/portrait/qbanrenwu/img_role_63.png,,12,personal/img_bjt3.png,2,100,{y=436;x=1750},{y=0;x=0},辛俐是帕底亚四天王的一员，精通地面属性，此外她也是帕底亚地区宝可梦联盟的面试官,辛俐是帕底亞四天王的一員，精通地面屬性，此外她也是帕底亞地區寶可夢聯盟的考官。,"Rika là một thành viên của Tứ Đại Thiên Vương Paldea, chuyên về hệ Đất. Ngoài ra, cô còn là người phỏng vấn của Liên Minh Pokémon vùng Paldea.","Rika is a member of the Paldea Elite Four who specializes in Ground-types. Additionally, she also serves as an interviewer for the Paldea Pokémon League.","칠리는 팔데아 사천왕의 일원으로 땅타입을 전문으로 다루며, 팔데아지방 포켓몬 리그의 면접관이기도 합니다.","Rika é um membro da Elite dos Quatro de Paldea, especialista em tipos Terrestres. Além disso, ela também atua como entrevistadora para a Liga Pokémon de Paldea.",ซากิเป็นหนึ่งในสี่จตุรเทพแห่งพัลเดีย เชี่ยวชาญโปเกมอนประเภทพื้นดิน นอกจากนี้เธอยังเป็นผู้สัมภาษณ์ของโปเกมอนลีกภูมิภาคพัลเดียอีกด้วย,{5=13},VIP等級13級後可解鎖,VIP等級13級後可解鎖,Mở khóa ở VIP cấp 13,Unlocked at VIP Level 13,VIP 등급 13 달성 시 해제,Desbloqueado no Nível VIP 13,ปลดล็อกเมื่อถึง VIP ระดับ 13,,{rmb=58888},0,8,2%,0,8,480,0,0,,<70047>,<1>,0,0,0,0,0,TRUE,{y=-50;x=160},,1,1,1,1,1,1,1,1,1,1,1,1,1,,1,1,1,1,1,1,{y=0;x=0}
64,欧尼奥(万圣节),欧尼奥（万圣节）,Allister's (Halloween) token,Allister's (Halloween) token,Allister's (Halloween) token,Allister's (Halloween) token,Allister's (Halloween) token,,config/portrait/toptouxiang/img_role_64@.png,config/big_role/show/img_role_64@.png,config/big_role/show/img_role_64@.png,figure/ouniao/ouniao.skel,crossmine/q_xiaozhi.skel,config/portrait/qbanrenwu/img_role_64.png,,12,personal/img_bjt3.png,2,100,{y=436;x=1750},{y=0;x=0},欧尼奥的个性极度内向且胆小由于害怕别人的目光，因此总是戴着面具。欧尼奥平常很少出现在人前，似乎经常一个人待在遗迹和墓地里,歐尼奧的個性極度內向且膽小，由於害怕別人的目光，因此總是戴著面具。歐尼奧平常很少出現在人前，似乎經常一個人待在遺址和墓地裡。,"Allister có tính cách cực kỳ hướng nội và nhút nhát. Do sợ ánh mắt của người khác, cậu luôn đeo mặt nạ. Allister hiếm khi xuất hiện trước mặt mọi người và dường như thường ở một mình trong các di tích và nghĩa địa.","Allister is extremely introverted and timid. Due to his fear of being looked at, he always wears a mask. Allister rarely appears in front of others and seems to often spend his time alone in ruins and cemeteries.","어니언은 극도로 내성적이고 소심한 성격으로, 다른 사람의 시선을 두려워해 항상 가면을 쓰고 있습니다. 평소에는 사람들 앞에 잘 나타나지 않으며, 유적이나 묘지에서 혼자 시간을 보내는 일이 잦은 것 같습니다.","Allister é extremamente introvertido e tímido. Por medo do olhar dos outros, ele sempre usa uma máscara. Allister raramente aparece na frente dos outros e parece passar muito tempo sozinho em ruínas e cemitérios.",ออลนิโอมีนิสัยเก็บตัวและขี้อายอย่างมาก เนื่องจากกลัวสายตาของคนอื่น เขาจึงสวมหน้ากากอยู่เสมอ โดยปกติออลนิโอไม่ค่อยปรากฏตัวต่อหน้าผู้คน และดูเหมือนว่าเขามักจะอยู่คนเดียวตามซากปรักหักพังและสุสาน,{5=14},VIP等級14級後可解鎖,VIP等級14級後可解鎖,Mở khóa ở VIP cấp 14,Unlocked at VIP Level 14,VIP 등급 14 달성 시 해제,Desbloqueado no Nível VIP 14,ปลดล็อกเมื่อถึง VIP ระดับ 14,,{rmb=78888},0,9,2%,0,9,240,0,0,,<70048>,<1>,0,0,0,0,0,TRUE,{y=-50;x=160},,1,1,1,1,1,1,1,1,1,1,1,1,1,,1,1,1,1,1,1,{y=0;x=0}
65,玛俐,玛俐,Marnie's token,Marnie's token,Marnie's token,Marnie's token,Marnie's token,,config/portrait/toptouxiang/img_role_65@.png,config/big_role/show/img_role_65@.png,config/big_role/show/img_role_65@.png,figure/mali/mali.skel,crossmine/q_xiaozhi.skel,config/portrait/qbanrenwu/img_role_65.png,,12,personal/img_bjt3.png,2,100,{y=436;x=1750},{y=0;x=0},玛俐拥有不服输的个性，平常喜怒不形于色，但--旦怒火爆发则久久难以平息，而她私底下会试图通过抬起嘴角练习微笑,瑪俐擁有不服輸的個性，平常喜怒不形於色，但一旦怒火爆發則久久難以平息，而她私底下會試圖透過抬起嘴角練習微笑。,"Marnie có tính cách không chịu thua, bình thường không biểu lộ cảm xúc, nhưng một khi nổi giận thì rất lâu mới nguôi. Cô ấy thường lén luyện tập mỉm cười bằng cách nhếch mép.","Marnie has a competitive personality and usually doesn't show her emotions. However, once her anger erupts, it takes a long time to calm down. In private, she tries to practice smiling by lifting the corners of her mouth.","마리는 지기 싫어하는 성격으로 평소에는 희로애락을 잘 드러내지 않지만, 한번 화가 나면 좀처럼 가라앉지 않습니다. 남몰래 입꼬리를 올리며 미소 짓는 연습을 하기도 합니다.","Marnie tem uma personalidade competitiva e geralmente não demonstra suas emoções, mas quando sua raiva explode, leva muito tempo para se acalmar. Em particular, ela tenta praticar sorrir levantando os cantos da boca.",มารีมีนิสัยไม่ยอมแพ้ ปกติจะไม่แสดงอารมณ์ออกมาทางสีหน้า แต่เมื่อโกรธขึ้นมาแล้วจะใช้เวลานานกว่าจะสงบลง และเธอมักจะแอบฝึกยิ้มด้วยการยกมุมปากขึ้น,{5=14},VIP等級14級後可解鎖,VIP等級14級後可解鎖,Mở khóa ở VIP cấp 14,Unlocked at VIP Level 14,VIP 등급 14 달성 시 해제,Desbloqueado no Nível VIP 14,ปลดล็อกเมื่อถึง VIP ระดับ 14,,{rmb=78888},0,1,4%,0,23,4%,0,0,,<70049>,<1>,0,0,0,0,0,TRUE,{y=-50;x=160},,1,1,1,1,1,1,1,1,1,1,1,1,1,,1,1,1,1,1,1,{y=0;x=0}
66,奇树,哈瑟,Hassel,Hassel,하셀,Hassel,Hassel,,config/portrait/toptouxiang/img_role_66@.png,config/big_role/show/img_role_66@.png,config/big_role/show/img_role_66@.png,figure/qishu/qishu.skel,crossmine/q_xiaozhi.skel,config/portrait/qbanrenwu/img_role_66.png,,12,personal/img_bjt3.png,2,100,{y=436;x=1750},{y=0;x=0},酿光市酿光道馆的道馆馆主，精通电属性宝可梦，同时也是一名人气直播主,奇樹是釀光市釀光道館的道館館主，精通電屬性寶可夢，同時也是一名人氣直播主。,"Iono là Trưởng Nhà thi đấu Levincia tại Thành phố Levincia, chuyên về các Pokémon hệ Điện và cũng là một streamer nổi tiếng.",Iono is the Gym Leader of Levincia Gym in Levincia City. She specializes in Electric-type Pokémon and is also a popular streamer.,"모야모는 누룩스시티의 누룩스체육관 관장으로, 전기타입 포켓몬을 전문으로 다루며 인기 스트리머이기도 합니다.","Iono é a Líder de Ginásio de Levincia, especialista em Pokémon do tipo Elétrico e também uma streamer popular.",นานาโมเป็นยิมลีดเดอร์ของยิมนันจาโมในเมืองนันจาโม เชี่ยวชาญโปเกมอนประเภทไฟฟ้า และยังเป็นสตรีมเมอร์ยอดนิยมอีกด้วย,{5=14},VIP等級14級後可解鎖,VIP等級14級後可解鎖,Mở khóa ở VIP cấp 14,Unlocked at VIP Level 14,VIP 등급 14 달성 시 해제,Desbloqueado no Nível VIP 14,ปลดล็อกเมื่อถึง VIP ระดับ 14,,{rmb=78888},0,8,3%,0,8,720,0,0,,<70050>,<1>,0,0,0,0,0,TRUE,{y=-50;x=160},,1,1,1,1,1,1,1,1,1,1,1,1,1,,1,1,1,1,1,1,{y=0;x=0}
67,莉可(新春限定),莉可（新春限定）,Liko (phiên bản Tết),Liko (Lunar New Year ver.),리코 (신춘 한정),Liko (versão de Ano Novo Lunar),Liko (เวอร์ชั่นตรุษจีน),,config/portrait/toptouxiang/img_role_67@.png,config/big_role/show/img_role_67@.png,config/big_role/show/img_role_67@.png,figure/like_xinchun/like_xinchun.skel,crossmine/q_xiaozhi.skel,config/portrait/qbanrenwu/img_role_67.png,,12,personal/img_bjt3.png,2,100,{y=436;x=1750},{y=0;x=0},就读于石英学园的学生，也是升龙伏特攻击队的一员，，拥有神秘的坠饰,就讀於石英學園的學生，也是昇龍伏特攻擊隊的一員，擁有神秘的墜飾。,"Một học sinh tại Học viện Indigo và là thành viên của đội Rising Volt Tacklers, sở hữu một mặt dây chuyền bí ẩn.","A student at Indigo Academy and a member of the Rising Volt Tacklers, who possesses a mysterious pendant.","세키에이학원의 학생이자 라이징 볼트태클즈의 일원으로, 신비한 펜던트를 가지고 있습니다.","Um estudante da Academia Índigo e membro dos Trovonautas, que possui um pingente misterioso.",นักเรียนที่กำลังศึกษาอยู่ที่โรงเรียนเซคิเอย์ และเป็นสมาชิกของทีมไรซิ่งโวลต์แทคเกิลส์ ผู้ครอบครองจี้ปริศนา,{5=15},VIP等級15級後可解鎖,VIP等級15級後可解鎖,Mở khóa ở VIP cấp 15,Unlocked at VIP Level 15,VIP 등급 15 달성 시 해제,Desbloqueado no Nível VIP 15,ปลดล็อกเมื่อถึง VIP ระดับ 15,,{rmb=98888},0,1,5%,0,23,5%,0,0,,<70051>,<1>,0,0,0,0,0,TRUE,{y=-50;x=160},,1,1,1,1,1,1,1,1,1,1,1,1,1,,1,1,1,1,1,1,{y=0;x=0}
68,梅洛可,梅洛可,Murdock,Murdock,머독,Murdock,Murdock,,config/portrait/toptouxiang/img_role_68@.png,config/big_role/show/img_role_68@.png,config/big_role/show/img_role_68@.png,figure/meiluoke/meiluoke.skel,crossmine/q_xiaozhi.skel,config/portrait/qbanrenwu/img_role_68.png,,12,personal/img_bjt3.png,2,100,{y=436;x=1750},{y=0;x=0},天星队火帮班，王良四小队的老大，是天星队首屈一指的万事通，遇到任何问题都能强硬解决,梅洛可為天星隊火幫班，王良四小隊的老大，是天星隊首屈一指的萬事通，遇到任何問題都能強硬解決。,"Mela là trùm của Biệt đội Schedar thuộc Team Star. Cô là người giải quyết mọi vấn đề hàng đầu của Team Star, có khả năng giải quyết mọi vấn đề một cách mạnh mẽ.","Mela is the boss of Team Star's Schedar Squad. She is Team Star's foremost problem-solver, capable of forcefully resolving any issue.","멜로코는 스타단 불꽃반, 셰다르 스쿼드의 보스입니다. 스타단 최고의 해결사로, 어떤 문제든 강력하게 해결합니다.","Mela é a chefe do Esquadrão Schedar da Equipe Star. Ela é a principal resolvedora de problemas da Equipe Star, capaz de resolver qualquer questão à força.",เมโลโกะเป็นหัวหน้าทีมไฟของแก๊งสตาร์ ทีมเชดาร์ เธอเป็นนักแก้ปัญหาอันดับหนึ่งของแก๊งสตาร์ สามารถแก้ไขปัญหาทุกอย่างได้อย่างเด็ดขาด,{5=15},VIP等級15級後可解鎖,VIP等級15級後可解鎖,Mở khóa ở VIP cấp 15,Unlocked at VIP Level 15,VIP 등급 15 달성 시 해제,Desbloqueado no Nível VIP 15,ปลดล็อกเมื่อถึง VIP ระดับ 15,,{rmb=98888},0,7,4%,0,7,960,0,0,,<70052>,<1>,0,0,0,0,0,TRUE,{y=-50;x=160},,1,1,1,1,1,1,1,1,1,1,1,1,1,,1,1,1,1,1,1,{y=0;x=0}
69,莉可,莉可,Liko,Liko,리코,Liko,Liko,,config/portrait/toptouxiang/img_role_69@.png,config/big_role/show/img_role_69@.png,config/big_role/show/img_role_69@.png,figure/like/like.skel,crossmine/q_xiaozhi.skel,config/portrait/qbanrenwu/img_role_69.png,,12,personal/img_bjt3.png,2,100,{y=436;x=1750},{y=0;x=0},一名出身于帕底亚地区的少女以从外婆那里得到的“不可思议的吊坠”为契机，开始了旅行,一名出身於帕底亞地區的少女，以從外婆那裡得到的「不可思議的吊墜」為契機，開始了旅行。,"Một cô gái trẻ đến từ vùng Paldea, bắt đầu cuộc hành trình của mình sau khi nhận được một ""mặt dây chuyền bí ẩn"" từ bà ngoại.","A young girl from the Paldea region who begins her journey after receiving a ""mysterious pendant"" from her grandmother.",할머니에게 받은 '신비한 펜던트'를 계기로 여행을 시작하게 된 팔데아지방 출신의 소녀입니다.,"Uma jovem da região de Paldea que inicia sua jornada após receber um ""pingente misterioso"" de sua avó.","เด็กสาวจากภูมิภาคพัลเดียที่เริ่มต้นการเดินทางหลังจากได้รับ ""จี้มหัศจรรย์"" จากคุณยายของเธอ",{5=15},VIP等級15級後可解鎖,VIP等級15級後可解鎖,Mở khóa ở VIP cấp 15,Unlocked at VIP Level 15,VIP 등급 15 달성 시 해제,Desbloqueado no Nível VIP 15,ปลดล็อกเมื่อถึง VIP ระดับ 15,,{rmb=98888},0,1,5%,0,0,0,0,0,,<70053>,<1>,0,0,0,0,0,TRUE,{y=-50;x=160},,1,1,1,1,1,1,1,1,1,1,1,1,1,,1,1,1,1,1,1,{y=0;x=0}
