变量名,name,name_tw,name_vn,name_en,name_kr,name_pt,name_th,languages,logo,res,resAct,resSpine,crossMineResSpine,qFigureres,qRoleSpine,zOrder,resBack,type,showIdx,pos,actPos,desc,desc_tw,desc_vn,desc_en,desc_kr,desc_pt,desc_th,unlock,unlockDesc,unlockDesc_tw,unlockDesc_vn,unlockDesc_en,unlockDesc_kr,unlockDesc_pt,unlockDesc_th,unavalibleDesc,activeCost,attrNatureType1,attrType1,attrValue1,attrNatureType2,attrType2,attrValue2,attrNatureType3,attrType3,attrValue3,skills,activeLevel,hide,hide_tw,hide_en,hide_vn,hide_kr,overture,offPos,chattext1,chattext1_tw,chattext1_en,chattext1_vn,chattext1_kr,chattext1_pt,chattext1_th,chattext2,chattext2_tw,chattext2_en,chattext2_vn,chattext2_kr,chattext2_pt,chattext2_th,chattext3,chattext3_tw,chattext3_en,chattext3_vn,chattext3_kr,chattext3_pt,chattext3_th,crossArenaPos
40,格拉吉欧,格拉吉歐,Gladio,Gladio,Gladio,Gladio,กลาดิโอ,,config/portrait/toptouxiang/img_role_40@.png,config/big_role/show/img_role_40@.png,config/big_role/show/img_role_40@.png,figure/gelajiou/gelajiou.skel,crossmine/q_xiaozhi.skel,config/portrait/qbanrenwu/img_role_40@.png,,12,personal/img_bjt.png,2,120,{y=436;x=1750},{y=0;x=0},格拉吉欧,他是骷髏隊的執行者，也是以太基金會的成員，與他的母親露莎米奈和妹妹莉莉一起。,"Trang phục mùa hè, thích cưỡi Lapras và câu cá biển.","He works for Team Skull as an enforcer,  also a member of the Aether Foundation together with his mother Lusamine and his sister Lillie.","그는 해골단의 집행원이자, 어머니 루자미네와 여동생 릴리에와 함께 에테르 재단의 일원입니다.",Ele trabalha como executor da Equipe Skull e também é membro da Fundação Aether junto com sua mãe Lusamine e sua irmã Lillie.,เขาเป็นผู้บังคับใช้ของทีมสกัล และยังเป็นสมาชิกของมูลนิธิเอเธอร์ร่วมกับแม่ของเขา ลูซามีน และน้องสาวของเขา ลิลลี่,{1=10},特殊活动投放,特殊活動投放,Put in for Special Event,Put in for Special Event,특수 이벤트 지급,Coloque em evento especial,ใส่สำหรับกิจกรรมพิเศษ,,{2245=1},0,7,1%,0,7,240,0,0,,<70036>,<1>,0,0,0,0,0,TRUE,{y=-50;x=160},格拉吉欧,骷髏隊……那時我想，只要讓我們更強，做什麼都無所謂,Team Skulls... at that time I thought it didn't matter what I did as long as it made us stronger,team skulls… lúc đó tôi nghĩ làm gì cũng được miễn là mạnh hơn,팀 스컬즈… 그때는 우리가 강해지기만 하면 뭐든 괜찮다고 생각했어,"time skulls… naquela época eu pensei que não importava o que eu fizesse, desde que nos tornasse mais fortes",ทีมสกัลส์… ตอนนั้นฉันคิดว่าไม่สำคัญว่าฉันจะทำอะไร ตราบใดที่ทำให้เราหนักแน่นขึ้น,格拉吉欧,席多藍恩，前身是零式，過去是為某個目的被創造的。,"Silvally, formerly known as Type: Null, was created in the past for a purpose.","Silvally, trước đây gọi là Type: Null, được tạo ra với một mục đích trong quá khứ.","실발리, 예전에는 타입: 널, 과거에 어떤 목적으로 만들어졌어.","Silvally, antes conhecido como Tipo: Nulo, foi criado no passado com um propósito.",ซิลวัลลี่ เดิมชื่อไทป์: นัล ถูกสร้างขึ้นเมื่อก่อนด้วยจุดประสงค์บางอย่าง,格拉吉欧,我有個妹妹。她很溫柔。她以前不太願意讓寶可夢戰鬥。她太溫柔了，讓人擔心。,"I have a younger sister. She is very gentle. She used to be reluctant to let Pokemon fight. She is too gentle, to the point of worrying.",tớ có một em gái. cô ấy rất dịu dàng. trước đây cô ấy không muốn pokemon chiến đấu. cô ấy dịu dàng đến mức làm tớ lo lắng.,나는 여동생이 있어. 그녀는 매우 부드러워. 예전에는 포켓몬 싸움을 꺼렸어. 너무 부드러워서 걱정돼.,"Eu tenho uma irmã mais nova. Ela é muito gentil. Antes, relutava em deixar Pokémon lutarem. Ela é tão gentil que me preocupo.",ฉันมีน้องสาว เธอใจดีมาก เคยลังเลที่จะให้โปเกมอนสู้กัน เธอใจดีเกินไปจนเป็นห่วง,{y=0;x=0}
41,玛奥,瑪奧,Mallow,Mallow,Mallow,Mallow,แมลโลว์,,config/portrait/toptouxiang/img_role_41@.png,config/big_role/show/img_role_41@.png,config/big_role/show/img_role_41@.png,figure/maao/maao.skel,crossmine/q_xiaozhi.skel,config/portrait/qbanrenwu/img_role_41@.png,,12,personal/img_bjt4.png,2,110,{y=436;x=1750},{y=0;x=0},《太阳／月亮》系列动画的女主之一，系列游戏的诸岛巡礼队长之一，艾纳餐馆一名热情开朗的厨师，她喜欢烹饪而且水平不错，但是有些时候她烹饪的品味会变得十分奇特,她是《太陽／月亮》系列中的一位女性角色，是島嶼挑戰的隊長之一，擔任艾娜廚房的主廚。她擅長烹飪並熱愛其中，但有時她的口味會變得非常奇特。,"Làm việc cho Đội Skull kiêm thành viên Quỹ Aether, sống cùng mẹ và em gái.","One of female character in [Sun/Moon] series, one of the leaders in island challenge, as the chef of Aina's Kitchen, she's good at cooking and liking it, but sometimes her taste will become very strange","그녀는 [썬/문] 시리즈의 여성 캐릭터 중 한 명으로, 섬 챌린지의 주역 중 하나이며, 아이나 키친의 요리사입니다. 요리를 잘하고 좋아하지만, 때때로 그녀의 미각은 매우 이상해집니다.","Uma das personagens femininas da série [Sun/Moon], uma das líderes do desafio das ilhas, chef da Cozinha da Aina, é boa em cozinhar e gosta disso, mas às vezes seu gosto pode ser bem estranho.",หนึ่งในตัวละครหญิงจากซีรีส์ [Sun/Moon] เป็นผู้นำท้าทายเกาะ และเป็นพ่อครัวที่ร้านอาหาร Aina’s Kitchen เธอทำอาหารเก่งและรักการทำอาหาร แต่รสชาติของเธอบางครั้งก็แปลกมาก,{1=10},特殊活动投放,特殊活動投放,Put in for Special Event,Put in for Special Event,특수 이벤트 지급,Coloque em evento especial,ใส่สำหรับกิจกรรมพิเศษ,,{2246=1},0,9,1%,0,10,1%,0,0,,<70033>,<1>,0,0,0,0,0,TRUE,{y=-50;x=160},来尝尝我的真本事！,讓我看看你有什麼！,Let me see what you got!,để tôi xem bạn có gì!,내가 가진 걸 보여줘!,deixa eu ver o que você tem!,ให้ฉันดูสิว่าคุณมีอะไรบ้าง!,金色花蜜！一切都是为了让幻之料理称为艾纳餐馆的招牌菜！,金色蜂蜜！我所做的一切都是讓神秘料理成為艾娜廚房的招牌！,Golden Honey! All I do is to make mysterious cuisine become the chef's special at Aina's Kitchene,Mật Ong Vàng! Tất cả những gì tôi làm là biến món ăn bí ẩn thành đặc sản của bếp Aina!,황금 꿀! 나는 신비한 요리를 아이나의 주방 특선으로 만드는 게 전부야!,Mel Dourado! Tudo que faço é tornar a culinária misteriosa o prato especial na cozinha da Aina,น้ำผึ้งทอง! สิ่งที่ฉันทำคือทำอาหารลึกลับให้กลายเป็นเมนูพิเศษของเชฟที่ครัวไอนะ,我的梦想就是让艾纳餐馆成为阿罗拉最好的餐馆！,我有個妹妹。她很溫柔。她以前不太願意讓寶可夢戰鬥。她太溫柔了，讓人擔心。,"I have a younger sister. She is very gentle. She used to be reluctant to let Pokemon fight. She is too gentle, to the point of worrying.",tớ có một em gái. cô ấy rất dịu dàng. trước đây cô ấy không muốn pokemon chiến đấu. cô ấy dịu dàng đến mức làm tớ lo lắng.,나는 여동생이 있어. 그녀는 매우 부드러워. 예전에는 포켓몬 싸움을 꺼렸어. 너무 부드러워서 걱정돼.,"Eu tenho uma irmã mais nova. Ela é muito gentil. Antes, relutava em deixar Pokémon lutarem. Ela é tão gentil que me preocupo.",ฉันมีน้องสาว เธอใจดีมาก เคยลังเลที่จะให้โปเกมอนสู้กัน เธอใจดีเกินไปจนเป็นห่วง,{y=0;x=0}
42,莉莉艾,莉莉艾,Lillie,Lillie,Lillie,Lillie,ลิลลี,,config/portrait/toptouxiang/img_role_42@.png,config/big_role/show/img_role_42@.png,config/big_role/show/img_role_42@.png,figure/liliai/liliai.skel,crossmine/q_xiaozhi.skel,config/portrait/qbanrenwu/img_role_42@.png,,12,personal/img_bjt1.png,2,100,{y=436;x=1750},{y=0;x=0},《太阳／月亮》系列的女主之一，“阿罗拉绽放的冰之花”，是阿罗拉地区美乐美乐岛的宝可梦学校的学生，小智的同班同学。她是以太基金会的大小姐，对于宝可梦的知识上是全班No.1。,她是《太陽／月亮》系列中的一位女性角色，被稱為阿羅拉的綻放冰之花。她是美樂美樂島上寶可夢學校的學生，與小智是同班同學，在班上對寶可夢的知識最為了解。,"Nữ thử thách đảo Alola, đầu bếp tại Aina's Kitchen. Giỏi nấu ăn nhưng đôi khi có khẩu vị kỳ lạ.","One of female character in [Sun/Moon] series, as known as Blooming Ice Flower of Alola. A student of Pokemon school in Melemele Island, classmate of Ash, she knows the best about Pokemon knowledge in class","그녀는 [썬/문] 시리즈의 여성 캐릭터로, 알로라의 '피어나는 얼음꽃'으로 알려져 있습니다. 멜레멜레섬 포켓몬 학교의 학생이며 지우의 반 친구로, 반에서 포켓몬 지식이 가장 뛰어납니다.","Uma das personagens femininas da série [Sun/Moon], conhecida como a Flor de Gelo em Flor de Alola. Estudante da escola Pokémon na Ilha Melemele, colega de classe de Ash, é a melhor da turma em conhecimento Pokémon.",หนึ่งในตัวละครหญิงจาก [Sun/Moon] รู้จักกันในชื่อดอกไม้น้ำแข็งที่ผลิบานแห่ง Alola เป็นนักเรียนที่โรงเรียนโปเกมอนบนเกาะ Melemele และเป็นเพื่อนร่วมห้องของ Satoshi เธอมีความรู้เรื่องโปเกมอนดีที่สุดในห้อง,{1=10},特殊活动投放,特殊活動投放,Put in for Special Event,Put in for Special Event,특수 이벤트 지급,Coloque em evento especial,ใส่สำหรับกิจกรรมพิเศษ,,{2247=1},0,1,1%,0,0,,0,0,,<70028>,<1>,0,0,0,0,0,TRUE,{y=-50;x=160},我会遇到很多出色的宝可梦，并成为训练家……我会像诸岛巡礼一样，去各地旅行！,我會遇到很多優秀的寶可夢並成為訓練家！我會到各個地方去挑戰島嶼挑戰！,I’ll meet a lot of excellent Pokémons and become a trainer! I’ll travel to different places like island challenge!,tôi sẽ gặp nhiều pokémon tuyệt vời và trở thành huấn luyện viên! tôi sẽ đi khắp nơi như thử thách đảo!,나는 많은 훌륭한 포켓몬을 만나고 트레이너가 될 거야! 섬 도전을 위해 여러 곳을 여행할 거야!,"vou encontrar muitos pokémons excelentes e me tornar um treinador! vou viajar para diferentes lugares, como no desafio das ilhas!",ฉันจะเจอโปเกมอนที่ยอดเยี่ยมมากมายและกลายเป็นเทรนเนอร์! ฉันจะเดินทางไปยังที่ต่างๆ เหมือนท้าทายเกาะ!,能够遇见你们，真是太好了。,很高興見到你！,It is so nice to meet you!,Rất vui được gặp bạn!,만나서 반가워!,É muito bom te conhecer!,ดีใจที่ได้พบคุณ!,所以，我早晚……会回阿罗拉来的！,我遲早會回到阿羅拉！,I'll come back to Alola sooner or later!,tớ sẽ quay lại alola sớm hay muộn!,나는 조만간 알로라로 돌아올 거야!,Eu voltarei para Alola mais cedo ou mais tarde!,ฉันจะกลับมาอาโลลาไม่ช้าก็เร็ว!,{y=0;x=0}
43,阿塞萝拉,阿塞蘿拉,Acerola,Acerola,Acerola,Aserora,อาเซโรรา,,config/portrait/toptouxiang/img_role_43@.png,config/big_role/show/img_role_43@.png,config/big_role/show/img_role_43@.png,figure/asll/asll.skel,crossmine/q_xiaozhi.skel,config/portrait/qbanrenwu/img_role_43@.png,,12,personal/img_bjt3.png,2,100,{y=436;x=1750},{y=0;x=0},阿罗拉地区的四天王之一，也是乌拉乌拉岛超值超市旧址的队长，擅长幽灵属性,她是阿羅拉地區的四大天王之一，同時也是烏拉烏拉島上超值大賣場的隊長，擅長使用幽靈屬性寶可夢。,"Nữ sinh trường Pokémon đảo Melemele, bạn cùng lớp Ash, được mệnh danh ""Hoa Băng Nở Rộ Alola"", hiểu biết Pokémon nhất lớp.","One of the Elite Four in Alola Region, also the leader of Thrifty Megamart in Ula'ula Island, skilled in Ghost type","그녀는 알로라 지역의 사천왕 중 한 명이며, 울라울라섬의 절약 슈퍼마켓 리더로서 고스트 타입 포켓몬을 잘 다룹니다.","Uma das Elite Four da região de Alola, também líder do Thrifty Megamart na Ilha Ula’ula, especialista em Pokémon do tipo Fantasma.",หนึ่งใน Elite Four ของภูมิภาค Alola เป็นหัวหน้าร้าน Thrifty Megamart บนเกาะ Ula’ula เชี่ยวชาญประเภทผี,{1=10},特殊活动投放,特殊活動投放,Put in for Special Event,Put in for Special Event,특수 이벤트 지급,Coloque em evento especial,ใส่สำหรับกิจกรรมพิเศษ,,{2248=1},0,1,1%,0,0,,0,0,,<70038>,<1>,0,0,0,0,0,TRUE,{y=-50;x=160},嗨～我是古代的公主，阿塞萝拉！同时也是阿罗拉的四天王喔！,嗨～我是古代公主 Acerola！也是阿羅拉地區的四天王之一！,"Hi~ I'm the ancient princess, Acerola! Also the Elite Four of Alola Region too!","chào~ tôi là công chúa cổ đại, acerola! cũng là một trong Tứ Thiên Vương vùng alola!",안녕~ 나는 고대 공주 아세롤라야! 그리고 알로라 지역의 사천왕 중 한 명이야!,"oi~ sou a antiga princesa, acerola! também sou uma das elite four da região de alola!",สวัสดี~ ฉันคือเจ้าหญิงโบราณ แอสเซโรลา! และฉันยังเป็นหนึ่งใน Elite Four ของภูมิภาคอโลลา!,嘎喔～！不给我点心，我就要捣蛋啰！,阿呼！不給糖就搗蛋！,Aohoo !Trick or treat!,Aohoo! Trick or treat!,아후! 트릭 오어 트릿!,Aohoo! Gostosuras ou travessuras!,อาฮู! ขนมหรือกลลวง!,阿塞萝拉再再再度登场！,阿瑟羅拉又來了！,Acerola incoming again!,acerola lại đến rồi!,아세롤라가 다시 나타났다!,Acerola chegando de novo!,อาเซโรล่ามาอีกแล้ว!,{y=0;x=0}
44,斗子圣诞节限定,斗子（聖誕限定）,Hilda(Christmas Limited),Hilda(Christmas Limited),Hilda(Christmas Limited),Hilda(Christmas Limited),Hilda(Christmas Limited),,config/portrait/toptouxiang/img_role_44@.png,config/big_role/show/img_role_44@.png,config/big_role/show/img_role_44@.png,figure/douzi_shengdan/shengdan_douzi.skel,crossmine/q_xiaozhi.skel,config/portrait/qbanrenwu/img_role_44@.png,,12,personal/img_bjt3.png,2,100,{y=436;x=1750},{y=0;x=0},是《黑／白》的女性主角,她是來自阿難鎮的女孩，穿著聖誕服裝，是《黑／白》中的女性主角。她的童年朋友是切倫和比安卡。,"Một trong Tứ Thiên Vương Alola, quản lý siêu thị Ula'ula, chuyên gia hệ Ma.","A girl fromNuvema Town wearing Christmas clothes, the female protagonist of \""Black/White\"", her childhood friends are Cheren and Bianca","그녀는 누베마 마을 출신의 소녀로, 크리스마스 복장을 입고 있으며, [블랙/화이트]의 여성 주인공입니다. 어릴 적 친구는 체렌과 벨입니다.","Uma garota de Nuvema vestida com roupas de Natal, protagonista feminina de “Black/White”, amiga de infância de Cheren e Bianca.",เด็กสาวจากเมือง Nuvema ในชุดคริสต์มาส เป็นตัวเอกหญิงของ “Black/White” เพื่อนสมัยเด็กของ Cheren และ Bianca,{5=13},VIP等級13級後可解鎖,VIP等級13級後可解鎖,Mở khóa ở VIP cấp 13,Unlocked at VIP Level 13,VIP 등급 13 달성 시 해제,Desbloqueado no Nível VIP 13,ปลดล็อกเมื่อถึง VIP ระดับ 13,,{rmb=58888},0,1,1%,0,0,,0,0,,<70034>,<1>,0,0,0,0,0,TRUE,{y=-50;x=160},玩得好爽啊！下次我们再来一场哦！,聖誕節了！你打算做什麼？,It's Christmas! What are you going to do?,giáng sinh rồi! bạn định làm gì?,크리스마스야! 뭐 할 거야?,é natal! o que você vai fazer?,นี่คือวันคริสต์มาส! คุณจะทำอะไร?,开始得晚不代表一定会弱哦！,馴鹿真可愛！,Reindeer are so cute!,Tuần lộc dễ thương quá!,순록 너무 귀여워!,As renas são tão fofas!,กวางเรนเดียร์น่ารักมาก!,一起去成为英雄吧！,我們一起打雪仗吧！,Let's go snowball fight together!,chúng ta cùng nhau chơi ném bóng tuyết nhé!,눈싸움 하러 가자!,Vamos fazer uma guerra de bolas de neve juntos!,มาเล่นโยนหิมะกันเถอะ!,{y=0;x=0}
45,美月春节限定,美月（春季限定）,Selene(New Year's Limited),Selene(New Year's Limited),Selene(New Year's Limited),Selene(New Year's Limited),Selene(New Year's Limited),,config/portrait/toptouxiang/img_role_45@.png,config/big_role/show/img_role_45@.png,config/big_role/show/img_role_45@.png,figure/meiyue_chunjie/chunjie_meiyue.skel,crossmine/q_xiaozhi.skel,config/portrait/qbanrenwu/img_role_45@.png,,12,personal/img_bjt3.png,2,100,{y=436;x=1750},{y=0;x=0},美月春节限定,她是身穿新年服裝的莉莉艾，是一位才華橫溢的女訓練家，阿羅拉聯盟的冠軍，阿羅拉圖鑑的大師，後來被邀請加入國際警察。,"Nữ chính [Đen/Trắng] từ Nuvema Town mặc đồ Giáng sinh, bạn thời thơ ấu của Cheren và Bianca.","Selene in a New Year dress, a talented girl trainer, a champion of the Alola League, a master of the Alola Pokedex, and later invited to join the international police","새해 옷을 입은 무스미(셀레나)는 재능 있는 여성 트레이너로, 알로라 리그 챔피언이자 알로라 포켓몬도감 마스터이며, 이후 국제경찰에 초대받습니다.","Selene com roupa de Ano Novo, uma treinadora talentosa, campeã da Liga de Alola, mestra da Pokédex de Alola, e depois convidada para a Polícia Internacional.",Selene ในชุดปีใหม่ เป็นเทรนเนอร์หญิงผู้มีพรสวรรค์ แชมป์ของลีก Alola ผู้เชี่ยวชาญ Pokédex ของ Alola และต่อมาได้รับเชิญให้เข้าร่วมตำรวจสากล,{5=13},VIP等級13級後可解鎖,VIP等級13級後可解鎖,Mở khóa ở VIP cấp 13,Unlocked at VIP Level 13,VIP 등급 13 달성 시 해제,Desbloqueado no Nível VIP 13,ปลดล็อกเมื่อถึง VIP ระดับ 13,,{rmb=58888},0,9,1%,0,0,,0,0,,<70023>,<1>,0,0,0,0,0,TRUE,{y=-50;x=160},美月春节限定,當然新年得穿新衣！你買了嗎？,Of course I have to wear new clothes for the new year! did you buy it?,tất nhiên tôi phải mặc đồ mới cho năm mới! bạn mua chưa?,물론 새해니까 새 옷 입어야지! 샀어?,claro que tenho que usar roupas novas para o ano novo! você comprou?,แน่นอนฉันต้องใส่ชุดใหม่รับปีใหม่! คุณซื้อหรือยัง?,美月春节限定,新年會發生什麼事？太興奮睡不著了！,What will happen in the new year? Too excited to sleep!,Năm mới sẽ có chuyện gì? Hào hứng quá không ngủ được!,새해에는 무슨 일이 일어날까? 너무 신나서 잠이 안 와!,O que vai acontecer no ano novo? Estou tão animado que não consigo dormir!,ปีใหม่นี้จะเกิดอะไรขึ้นนะ? ตื่นเต้นจนหลับไม่ได้!,美月春节限定,新的一年我們也應該保持開朗樂觀，以不輸給日月的能量加油！,"We should also be cheerful and optimistic in this new year, and come on with the energy that does not lose to the sun and the moon!","năm mới này chúng ta cũng nên vui vẻ và lạc quan, cố gắng với năng lượng không thua mặt trời và mặt trăng!",새해에는 태양과 달에도 지지 않는 에너지로 명랑하고 낙관적이어야 해!,"Também devemos ser alegres e otimistas neste ano novo, com energia que não perde para o sol e a lua!",ปีใหม่นี้เราควรสดใสและมองโลกในแง่ดี ใช้พลังที่ไม่แพ้ดวงอาทิตย์และดวงจันทร์!,{y=0;x=0}
